{
  "$schema": "./constraints.schema.json",
  "project": "Scanner OBD-II ESP32",
  "version": "2.0.0",
  "pcb_manifest": "./manifest.json",
  "schema_semantics": "../schema/semantics.json",
  "frame": {
    "unit": "mm",
    "origin": "bottom_left",
    "y_axis": "up",
    "rotation": "ccw_degrees",
    "internal_resolution_mm": 0.05,
    "final_snap_mm": 0.635
  },
  "board": {
    "outline_polygon_mm": [
      [0.0, 0.0],
      [81.28, 0.0],
      [81.28, 35.56],
      [0.0, 35.56]
    ],
    "width_mm": 81.28,
    "height_mm": 35.56,
    "layers": 4,
    "stackup": {
      "type": "4_layer_jlc2313",
      "layers": [
        { "id": 1, "name": "TopLayer", "type": "signal", "copper_oz": 1.0, "default_net": "GND", "description": "Composants CMS, signaux critiques, paires diff, RF" },
        { "id": 15, "name": "Inner1", "type": "plane", "copper_oz": 0.5, "default_net": "GND", "description": "Plan de masse GND continu et ininterrompu" },
        { "id": 16, "name": "Inner2", "type": "plane", "copper_oz": 0.5, "default_net": "+5V", "description": "Plan d'alimentation (+5V, 3.3V, +12V)" },
        { "id": 2, "name": "BottomLayer", "type": "signal", "copper_oz": 1.0, "default_net": "GND", "description": "Signaux secondaires et blindage de masse GND" }
      ]
    },
    "edge_clearance_mm": 0.30,
    "mounting_holes": [
      { "id": "MH1", "name": "Fixation Sud-Ouest", "x_mm": 3.5, "y_mm": 3.5,   "drill_mm": 2.2, "pad_mm": 4.5, "head_clearance_mm": 4.5, "net": "GND" },
      { "id": "MH2", "name": "Fixation Nord-Ouest", "x_mm": 3.5, "y_mm": 32.06, "drill_mm": 2.2, "pad_mm": 4.5, "head_clearance_mm": 4.5, "net": "GND" },
      { "id": "MH3", "name": "Fixation Sud-Est",   "x_mm": 77.78, "y_mm": 3.5,   "drill_mm": 2.2, "pad_mm": 4.5, "head_clearance_mm": 4.5, "net": "GND" },
      { "id": "MH4", "name": "Fixation Nord-Est",   "x_mm": 77.78, "y_mm": 32.06, "drill_mm": 2.2, "pad_mm": 4.5, "head_clearance_mm": 4.5, "net": "GND" }
    ]
  },
  "anchors": {
    "J1": {
      "x_mm": 10.16,
      "y_mm": 17.78,
      "rot_deg": 90.0,
      "edge_flush": "west"
    },
    "J2": {
      "x_mm": 40.64,
      "y_mm": 3.81,
      "rot_deg": 0.0,
      "edge_flush": "south"
    },
    "U1": {
      "x_mm": 63.00,
      "y_mm": 17.78,
      "rot_deg": 270.0
    },
    "H1": {
      "x_mm": 32.00,
      "y_mm": 31.50,
      "rot_deg": 0.0
    },
    "H2": {
      "x_mm": 48.00,
      "y_mm": 31.50,
      "rot_deg": 0.0
    },
    "H3": {
      "x_mm": 20.00,
      "y_mm": 31.50,
      "rot_deg": 0.0
    }
  },
  "keepout_zones": [
    {
      "id": "J1_MATING_KEEPOUT",
      "name": "Zone de dégagement enfichage connecteur OBD J1",
      "layer": "all",
      "rect_mm": {
        "x_min": 0.0,
        "x_max": 10.16,
        "y_min": 10.00,
        "y_max": 25.56
      },
      "exempt_refs": ["J1"],
      "rules": ["no_components"]
    },
    {
      "id": "RF_ANTENNA_KEEPOUT",
      "name": "Zone d'exclusion RF Antenne ESP32-S3",
      "layer": "all",
      "rect_mm": {
        "x_min": 73.50,
        "x_max": 81.28,
        "y_min": 8.78,
        "y_max": 26.78
      },
      "exempt_refs": ["U1"],
      "rules": ["no_wires", "no_vias", "no_pours"]
    }
  ],
  "padstack_overrides": {
    "bdbad5cc7fc4f6ae55": {
      "diameter_mm": 0.90,
      "description": "Fente mécanique gauche de blindage USB-C J2 (e55) gonflée à 0.90 mm pour garantir la garde DRC >= 0.30 mm sans chevaucher les pastilles CMS"
    },
    "bdbad5cc7fc4f6ae56": {
      "diameter_mm": 0.90,
      "description": "Fente mécanique droite de blindage USB-C J2 (e56) gonflée à 0.90 mm pour garantir la garde DRC >= 0.30 mm sans chevaucher les pastilles CMS"
    }
  },
  "separation_rules": [
    {
      "id": "SEP_BUCK_ANTENNA",
      "group_a": { "cluster": "buck_5v" },
      "group_b": { "zone": "RF_ANTENNA_KEEPOUT" },
      "min_distance_mm": 15.0,
      "coupling": "H_field",
      "frequency_mhz": 0.57,
      "hard": false,
      "weight": 6,
      "rationale": "Découpage Buck 570 kHz éloigné de l'antenne radio 2.4 GHz (décroissance dipolaire H en 1/r³)"
    },
    {
      "id": "SEP_AGGRESSOR_VICTIM",
      "group_a": { "emc_class": "aggressor" },
      "group_b": { "emc_class": "victim" },
      "min_distance_mm": 8.0,
      "coupling": "E_field",
      "frequency_mhz": 50.0,
      "hard": false,
      "weight": 5,
      "rationale": "Isolation des bus sensibles (USB, CAN) des commutations de puissance (décroissance capacitive E en 1/r²)"
    }
  ],
  "plane_nets": ["GND"],
  "net_classes": {
    "POWER_12V": {
      "nets": ["+12V", "+12V_PROT", "VBAT_SENSE"],
      "track_width_mm": 0.8,
      "clearance_mm": 0.25,
      "via_drill_mm": 0.4,
      "via_diameter_mm": 0.8,
      "emc_class": "power_raw",
      "description": "Rails de puissance 12V batterie et protections amont"
    },
    "POWER_REGULATED": {
      "nets": ["+5V", "3.3V", "3.3V_PRE"],
      "track_width_mm": 0.6,
      "clearance_mm": 0.20,
      "via_drill_mm": 0.4,
      "via_diameter_mm": 0.8,
      "emc_class": "power_clean",
      "description": "Distribution à faible impédance des rails 5V et 3.3V"
    },
    "POWER_USB": {
      "nets": ["VBUS_5V"],
      "track_width_mm": 0.35,
      "clearance_mm": 0.20,
      "via_drill_mm": 0.3,
      "via_diameter_mm": 0.6,
      "emc_class": "power_clean",
      "description": "Alimentation USB-C 5V adaptée au pas fin du connecteur USB-C J2"
    },
    "SWITCHING_BUCK": {
      "nets": ["PH_BUCK", "BOOT_BUCK", "$1N16", "$1N19"],
      "track_width_mm": 0.8,
      "clearance_mm": 0.30,
      "via_drill_mm": 0.4,
      "via_diameter_mm": 0.8,
      "emc_class": "aggressor",
      "description": "Nœud de commutation haute fréquence (570 kHz) et bootstrap"
    },
    "DIFF_USB": {
      "nets": ["USB_D+", "USB_D-"],
      "track_width_mm": 0.30,
      "clearance_mm": 0.20,
      "diff_pair": true,
      "diff_impedance_ohm": 90.0,
      "max_skew_mm": 15.0,
      "emc_class": "victim",
      "description": "Paire différentielle USB Full-Speed 90 Ohms (12 Mbps)"
    },
    "DIFF_CAN": {
      "nets": ["CANH", "CANL"],
      "track_width_mm": 0.30,
      "clearance_mm": 0.20,
      "diff_pair": true,
      "diff_impedance_ohm": 120.0,
      "max_skew_mm": 5.0,
      "emc_class": "victim",
      "description": "Paire différentielle CAN ISO 11898-2 120 Ohms"
    },
    "SIGNAL_CRITICAL": {
      "nets": ["K_LINE", "KLINE_RX", "KLINE_TX", "K_RX_IC", "K_TX_IC", "TWAI_RX", "TWAI_TX", "ESP_EN", "IO0", "$6N4", "$6N3", "$7N5"],
      "track_width_mm": 0.254,
      "clearance_mm": 0.20,
      "via_drill_mm": 0.3,
      "via_diameter_mm": 0.6,
      "emc_class": "signal",
      "description": "Signaux de communication série, TWAI et contrôle microcontrôleur"
    },
    "DEFAULT": {
      "nets": [],
      "track_width_mm": 0.254,
      "clearance_mm": 0.20,
      "via_drill_mm": 0.3,
      "via_diameter_mm": 0.6,
      "emc_class": "neutral",
      "description": "Signaux généraux par défaut"
    }
  }
}
